********************************************************************************
MEME - Motif discovery tool
********************************************************************************
MEME version 5.5.7 (Release date: Wed Jun 19 13:59:04 2024 -0700)

For further information on how to interpret these results please access http://localhost:8080/meme_5.5.7.
To get a copy of the MEME Suite software please access https://meme-suite.org.

********************************************************************************


********************************************************************************
REFERENCE
********************************************************************************
If you use this program in your research, please cite:

Timothy L. Bailey and Charles Elkan,
"Fitting a mixture model by expectation maximization to
discover motifs in biopolymers",
Proceedings of the Second International Conference on Intelligent Systems
for Molecular Biology, pp. 28-36, AAAI Press, Menlo Park, California, 1994.
********************************************************************************


********************************************************************************
TRAINING SET
********************************************************************************
PRIMARY SEQUENCES= data/tfbs_fastas/DeoR.fasta
CONTROL SEQUENCES= --none--
ALPHABET= ACGT
Sequence name            Weight Length  Sequence name            Weight Length  
-------------            ------ ------  -------------            ------ ------  
DeoR_3129                1.0000     36  DeoR_3130                1.0000     36  
DeoR_3131                1.0000     36  DeoR_3137                1.0000     36  
DeoR_3138                1.0000     36  DeoR_3139                1.0000     36  
DeoR_4346                1.0000     36  
********************************************************************************

********************************************************************************
COMMAND LINE SUMMARY
********************************************************************************
This information can also be useful in the event you wish to report a
problem with the MEME software.

command: meme data/tfbs_fastas/DeoR.fasta -oc meme_pwms/DeoR -dna -mod oops -nmotifs 1 -minw 6 -maxw 30 

model:  mod=          oops    nmotifs=         1    evt=           inf
objective function:           em=       E-value of product of p-values
                              starts=   E-value of product of p-values
strands: +
width:  minw=            6    maxw=           30
nsites: minsites=        7    maxsites=        7    wnsites=       0.8
theta:  spmap=         uni    spfuzz=        0.5
em:     prior=   dirichlet    b=            0.01    maxiter=        50
        distance=    1e-05
trim:   wg=             11    ws=              1    endgaps=       yes
data:   n=             252    N=               7
sample: seed=            0    hsfrac=          0
        searchsize=    252    norand=         no    csites=       1000
Letter frequencies in dataset:
A 0.23 C 0.23 G 0.214 T 0.325 
Background letter frequencies (from file dataset with add-one prior applied):
A 0.23 C 0.23 G 0.215 T 0.324 
Background model order: 0
********************************************************************************


********************************************************************************
MOTIF GTTASAWTKCTWWCA MEME-1	width =  15  sites =   7  llr = 67  E-value = 1.3e+000
********************************************************************************
--------------------------------------------------------------------------------
	Motif GTTASAWTKCTWWCA MEME-1 Description
--------------------------------------------------------------------------------
Simplified        A  :::7174:1:16619
pos.-specific     C  3:133:1::711:9:
probability       G  711:4:1:4:::1::
matrix            T  :97:133a43733:1

         bits    2.2                
                 2.0                
                 1.8                
                 1.6        *     **
Relative         1.3 *  *   *     **
Entropy          1.1 ** * * * *   **
(13.9 bits)      0.9 ** * * * *   **
                 0.7 **** * * ******
                 0.4 **** * ********
                 0.2 ***************
                 0.0 ---------------

Multilevel           GTTAGAATGCTAACA
consensus            C  CCTT TT TT  
sequence                            
                                    
--------------------------------------------------------------------------------

--------------------------------------------------------------------------------
	Motif GTTASAWTKCTWWCA MEME-1 sites sorted by position p-value
--------------------------------------------------------------------------------
Sequence name             Start   P-value                 Site    
-------------             ----- ---------            ---------------
DeoR_3129                    13  2.15e-09 CTCGTCTTGT GTTAGAATTCTAACA TACGGTTGC 
DeoR_3137                    13  1.70e-08 CGGAGTAGAT GTTAGAATACTAACA AACTCGCAA 
DeoR_4346                    12  2.56e-06 CCGTCATTTT GTTACTCTGCTTACA TCACCTGGAT
DeoR_3139                    14  1.10e-05 GCCCCCTTTT GTGAAAATTTTATCA TGCACCGG  
DeoR_3138                    12  1.22e-04 TTGTTTTCTG CTTCCAGTGCCAGAA AATGGCGCTT
DeoR_3131                    14  1.77e-04 GCGGCAATCC CTTCTTTTTCACACA GCAAGTTA  
DeoR_3130                    19  2.08e-04 CTGTGGGTAA GGCAGATTGTTTTCT GCT       
--------------------------------------------------------------------------------

--------------------------------------------------------------------------------
	Motif GTTASAWTKCTWWCA MEME-1 block diagrams
--------------------------------------------------------------------------------
SEQUENCE NAME            POSITION P-VALUE  MOTIF DIAGRAM
-------------            ----------------  -------------
DeoR_3129                         2.2e-09  12_[+1]_9
DeoR_3137                         1.7e-08  12_[+1]_9
DeoR_4346                         2.6e-06  11_[+1]_10
DeoR_3139                         1.1e-05  13_[+1]_8
DeoR_3138                         0.00012  11_[+1]_10
DeoR_3131                         0.00018  13_[+1]_8
DeoR_3130                         0.00021  18_[+1]_3
--------------------------------------------------------------------------------

--------------------------------------------------------------------------------
	Motif GTTASAWTKCTWWCA MEME-1 in BLOCKS format
--------------------------------------------------------------------------------
BL   MOTIF GTTASAWTKCTWWCA width=15 seqs=7
DeoR_3129                (   13) GTTAGAATTCTAACA  1 
DeoR_3137                (   13) GTTAGAATACTAACA  1 
DeoR_4346                (   12) GTTACTCTGCTTACA  1 
DeoR_3139                (   14) GTGAAAATTTTATCA  1 
DeoR_3138                (   12) CTTCCAGTGCCAGAA  1 
DeoR_3131                (   14) CTTCTTTTTCACACA  1 
DeoR_3130                (   19) GGCAGATTGTTTTCT  1 
//

--------------------------------------------------------------------------------

--------------------------------------------------------------------------------
	Motif GTTASAWTKCTWWCA MEME-1 position-specific scoring matrix
--------------------------------------------------------------------------------
log-odds matrix: alength= 4 w= 15 n= 154 bayes= 4.39232 E= 1.3e+000 
  -945     31    173   -945 
  -945   -945    -59    140 
  -945    -69    -59    114 
   163     31   -945   -945 
   -69     31    100   -118 
   163   -945   -945    -18 
    89    -69    -59    -18 
  -945   -945   -945    162 
   -69   -945    100     40 
  -945    163   -945    -18 
   -69    -69   -945    114 
   131    -69   -945    -18 
   131   -945    -59    -18 
   -69    189   -945   -945 
   189   -945   -945   -118 
--------------------------------------------------------------------------------

--------------------------------------------------------------------------------
	Motif GTTASAWTKCTWWCA MEME-1 position-specific probability matrix
--------------------------------------------------------------------------------
letter-probability matrix: alength= 4 w= 15 nsites= 7 E= 1.3e+000 
 0.000000  0.285714  0.714286  0.000000 
 0.000000  0.000000  0.142857  0.857143 
 0.000000  0.142857  0.142857  0.714286 
 0.714286  0.285714  0.000000  0.000000 
 0.142857  0.285714  0.428571  0.142857 
 0.714286  0.000000  0.000000  0.285714 
 0.428571  0.142857  0.142857  0.285714 
 0.000000  0.000000  0.000000  1.000000 
 0.142857  0.000000  0.428571  0.428571 
 0.000000  0.714286  0.000000  0.285714 
 0.142857  0.142857  0.000000  0.714286 
 0.571429  0.142857  0.000000  0.285714 
 0.571429  0.000000  0.142857  0.285714 
 0.142857  0.857143  0.000000  0.000000 
 0.857143  0.000000  0.000000  0.142857 
--------------------------------------------------------------------------------

--------------------------------------------------------------------------------
	Motif GTTASAWTKCTWWCA MEME-1 regular expression
--------------------------------------------------------------------------------
[GC]TT[AC][GC][AT][AT]T[GT][CT]T[AT][AT]CA
--------------------------------------------------------------------------------




Time  0.12 secs.

********************************************************************************


********************************************************************************
SUMMARY OF MOTIFS
********************************************************************************

--------------------------------------------------------------------------------
	Combined block diagrams: non-overlapping sites with p-value < 0.0001
--------------------------------------------------------------------------------
SEQUENCE NAME            COMBINED P-VALUE  MOTIF DIAGRAM
-------------            ----------------  -------------
DeoR_3129                        4.73e-08  12_[+1(2.15e-09)]_9
DeoR_3130                        4.57e-03  36
DeoR_3131                        3.88e-03  36
DeoR_3137                        3.75e-07  12_[+1(1.70e-08)]_9
DeoR_3138                        2.68e-03  36
DeoR_3139                        2.43e-04  13_[+1(1.10e-05)]_8
DeoR_4346                        5.64e-05  11_[+1(2.56e-06)]_10
--------------------------------------------------------------------------------

********************************************************************************


********************************************************************************
Stopped because requested number of motifs (1) found.
********************************************************************************

CPU: e12417741f2e

********************************************************************************
